location,keywords,sefaria_link
Berakhot 2a,"shema, sin, teruma, priest, torah, mitzva, mitzvot, burnt offering, creation, sin-offering, guilt-offering, torah law, impurity",https://www.sefaria.org.il/Berakhot.2a
Berakhot 2b,"priest, shema, teruma, sin, shabbat, torah",https://www.sefaria.org.il/Berakhot.2b
Berakhot 3a,"shema, prayer, priest, teruma, shabbat, the temple, sin, temple, destruction of the temple, mil",https://www.sefaria.org.il/Berakhot.3a
Berakhot 3b,"sin, torah, nasi, anger, righteous, shema, aramaic, exodus, parable, sanhedrin",https://www.sefaria.org.il/Berakhot.3b
Berakhot 4a,"sanhedrin, sin, mil, torah, impurity, righteous, shema, priest, torah study, prayer, creation, world-to-come, exodus, the exile",https://www.sefaria.org.il/Berakhot.4a
Berakhot 4b,"prayer, shema, sin, mitzva, world-to-come, creation, torah, rabbinic, exodus, mil",https://www.sefaria.org.il/Berakhot.4b
Berakhot 5a,"torah, shema, sin, prayer, mitzva, torah study, world-to-come, exodus, mitzvot, righteous, guilt-offering, meal-offering",https://www.sefaria.org.il/Berakhot.5a
Berakhot 5b,"prayer, leprosy, mercy, torah, impurity, sin, mil, divine presence, shema, the temple",https://www.sefaria.org.il/Berakhot.5b
Berakhot 6a,"sin, divine presence, phylacteries, prayer, torah, torah study, judgment, mitzva, mil, righteous, the temple, mitzvot, mercy, exodus",https://www.sefaria.org.il/Berakhot.6a
Berakhot 6b,"prayer, sin, shofar, mil, shabbat, wicked, mitzva, torah, thanks-offering, exodus, phylacteries, the temple, mitzvot, incense, mercy",https://www.sefaria.org.il/Berakhot.6b
Berakhot 7a,"righteous, anger, wicked, exodus, mercy, sin, divine presence, prayer, world-to-come, mil, phylacteries, israelites, high priest, incense, heretic, creation, mitzvot, levites",https://www.sefaria.org.il/Berakhot.7a
Berakhot 7b,"wicked, righteous, torah, prayer, mil, sin, gog and magog, judgment, mitzva, temple, anger, exodus, shalom, parable, mamzer, mercy, torah study, mitzvot",https://www.sefaria.org.il/Berakhot.7b
Berakhot 8a,"torah, prayer, sin, mil, mercy, torah study, the temple, shabbat, divine presence, mitzvot, world-to-come, aramaic",https://www.sefaria.org.il/Berakhot.8a
Berakhot 8b,"shema, torah, persian, anger, sin, phylacteries, gehenna, aramaic, the temple, mil",https://www.sefaria.org.il/Berakhot.8b
Berakhot 9a,"paschal lamb, shema, exodus, mitzva, sin, peace-offering, torah, mitzvot, paschal offering, prayer, passover, mil",https://www.sefaria.org.il/Berakhot.9a
Berakhot 9b,"prayer, sin, shema, mitzvot, parable, exodus, mitzva, wicked, righteous, tekhelet, torah, mil, phylacteries, world-to-come",https://www.sefaria.org.il/Berakhot.9b
Berakhot 10a,"sin, mercy, wicked, mil, creation, heretic, prayer, gog and magog, repented, righteous, purity, anger, gehenna, torah, world-to-come, mitzva, judgment",https://www.sefaria.org.il/Berakhot.10a
Berakhot 10b,"shema, sin, prayer, torah, mitzva, new moon, mil, exodus, torah study, mercy, temple, idol worship, the sanctuary, torah law, mitzvot, anger",https://www.sefaria.org.il/Berakhot.10b
Berakhot 11a,"shema, sin, mitzva, sukka, torah, phylacteries, mil, parable, mitzvot, sukkot, anger",https://www.sefaria.org.il/Berakhot.11a
Berakhot 11b,"sin, torah, shema, priest, the temple, mitzvot, high priest, prayer, shabbat, torah study, mil, temple, priestly benediction",https://www.sefaria.org.il/Berakhot.11b
Berakhot 12a,"sin, shema, priest, prayer, heretics, torah, mil, the temple, priestly benediction, shabbat",https://www.sefaria.org.il/Berakhot.12a
Berakhot 12b,"exodus, sin, torah, shema, righteous, mercy, the messiah, mitzva, mitzvot, prayer, priest, heretics, mil, anger, idol worship, torah law, phylacteries",https://www.sefaria.org.il/Berakhot.12b
Berakhot 13a,"shema, torah, mitzva, nasi, sin, parable, mitzvot, exodus, gog and magog, anger, mil, jewish people, righteous",https://www.sefaria.org.il/Berakhot.13a
Berakhot 13b,"shema, mitzva, nasi, exodus, sin, phylacteries, torah, mil, torah study",https://www.sefaria.org.il/Berakhot.13b
Berakhot 14a,"shema, righteous, rabbinic, sin, idol worship, prayer, torah",https://www.sefaria.org.il/Berakhot.14a
Berakhot 14b,"shema, phylacteries, sin, mitzvot, prayer, torah, mil, exodus, torah study, burnt-offering, meal-offering, peace-offering, libations",https://www.sefaria.org.il/Berakhot.14b
Berakhot 15a,"shema, teruma, sin, mil, purity, phylacteries, torah, prayer, tithes, rabbinic law",https://www.sefaria.org.il/Berakhot.15a
Berakhot 15b,"shema, sota, torah, mitzvot, mil, teruma, sin, mezuza, phylacteries, gehenna, a deaf-mute, an imbecile, and a minor, resurrection of the dead, priest, mitzva",https://www.sefaria.org.il/Berakhot.15b
Berakhot 16a,"shema, sin, prayer, mitzva, torah, priest, impurity, purity, mil, rabbinic law, torah law",https://www.sefaria.org.il/Berakhot.16a
Berakhot 16b,"prayer, shema, mil, sin, mitzva, torah, nasi, phylacteries, world-to-come, mitzvot, rabbinic law, torah law, rabbinic, garden of eden, mercy, satan",https://www.sefaria.org.il/Berakhot.16b
Berakhot 17a,"torah, prayer, sin, mitzvot, torah study, world-to-come, mil, mercy, the temple, creation, righteous, divine presence, exodus",https://www.sefaria.org.il/Berakhot.17a
Berakhot 17b,"shema, sin, torah, ninth of av, mil, righteous, prayer, mitzvot, shabbat, phylacteries, mitzva, mezuza",https://www.sefaria.org.il/Berakhot.17b
Berakhot 18a,"mitzvot, torah, sin, shema, phylacteries, prayer, shabbat, mitzva, anger, righteous",https://www.sefaria.org.il/Berakhot.18a
Berakhot 18b,"sin, wicked, torah, first temple, second temple, the temple, temple, righteous, divine presence, mil",https://www.sefaria.org.il/Berakhot.18b
Berakhot 19a,"shema, torah, sin, mil, repented, the temple, gehenna, paschal lamb, sota, purity, rabbinic, nasi, sanhedrin, passover, impurity, judgment, satan",https://www.sefaria.org.il/Berakhot.19a
Berakhot 19b,"torah, impurity, torah law, priest, mitzvot, rabbinic law, shema, sin, mitzva, rabbinic, nazirite, monetary law, paschal lamb, karet",https://www.sefaria.org.il/Berakhot.19b
Berakhot 20a,"mitzva, evil eye, mitzvot, torah, sin, mil, torah study, aramaic, parable, shema",https://www.sefaria.org.il/Berakhot.20a
Berakhot 20b,"mitzva, sin, torah law, shema, rabbinic law, torah, shabbat, prayer, mezuza, phylacteries, mitzvot, exodus, mercy, torah study, rabbinic, mil, ministering angels",https://www.sefaria.org.il/Berakhot.20b
Berakhot 21a,"sin, shema, torah, prayer, torah law, rabbinic law, mitzva, exodus, shabbat, one who experienced a seminal emission, mil, mitzvot",https://www.sefaria.org.il/Berakhot.21a
Berakhot 21b,"torah, prayer, mil, sin, one who experienced a seminal emission, impurity, exodus, shema, torah study, torah law, a menstruating woman",https://www.sefaria.org.il/Berakhot.21b
Berakhot 22a,"torah, sin, impurity, one who experienced a seminal emission, shema, torah study, shalom, mil, priest, torah law",https://www.sefaria.org.il/Berakhot.22a
